link,cp,prix,etg,ter,park,maj,ref,disp,gar,transp,prox,surf,const,piece,toil,toil_sep,sdb,meuble,rang,asc,chauf,cuis,gard,ent,calme,descr,hon,tel,score
"http://www.seloger.com/annonces/locations/appartement/paris-4eme-75/82466803.htm?cp=75&idqfix=1&idtt=1&idtypebien=1,2&tri=",75004,348 ,N.C,N.C,N.C,04 / 11 / 2013,82466803,,,metro_paris:Hotel de Ville,Métro hôtel de ville commerces,10,,1,,,,,,non,,,,,,"Chambre avec coin cuisine, rue du plâtre, au 7ème étage sans ascenseur. WC et douche communs à l'étage.","356,41 €",01 46 24 48 66,
"http://www.seloger.com/annonces/locations/appartement/paris-9eme-75/lorette-martyrs/83162365.htm?cp=75&idqfix=1&idtt=1&idtypebien=1,2",75009,335 ,6,non,N.C,04 / 11 / 2013,LHM10P9P,07 / 11 / 2013,,"metro_paris:Notre-Dame de Lorette,Pigalle,Saint-Georges",Notre Dame des Lorette,10,,1,,oui,,oui,,oui,,coin...,,,,"Visites directement sur place le jeudi 7 novembre 2013 à 19h00 au 70 rue des Martyrs, Paris 9ème. Métros Notre Dame de Lorette, Saint Georges ou Pigalle au 6ème et dernier étage avec ascenseur d'un immeuble ancien, une studette meublée en très bon état de 10 m², lit mezzanine, kitchenette avec évier aménagée et équipée, WC sur palier, PAS DE DOUCHE. Digicode et interphone, parties communes en très bon état, vue dégagée sur les toits de Paris.
Sur le site de Manestel (rubrique ""candidat locataire""), le dossier de candidature à compléter pour la visite.",,01 43 44 02 32,
"http://www.seloger.com/annonces/locations/appartement/paris-18eme-75/78463899.htm?bilance=all&bilanegs=all&cp=75&idqfix=1&idsubdivision=17649&idtt=1&idtypebien=1,2&nb_chambres=all&nb_pieces=all&pxbtw=NaN%2fNaN&surfacebtw=NaN%2fNaN&tri=d_px_loyer",75018,350 000 ,6,non,N.C,15 / 10 / 2013,10212,,,,,44,1900,2,,,,,,non,,américaine,,,oui,"Dans un bel immeuble ancien ravalé - grand deux pièces - sans perte de place - comprenant entrée, séjour avec cuisine US, chambre au calme sur cour, salle de bains, WC séparé et une cave - parquets moulures double vitrage -.",,01 55 25 19 50,
"http://www.seloger.com/annonces/locations/appartement/paris-8eme-75/parc-monceau/82439751.htm?bilance=all&bilanegs=all&cp=75&idqfix=1&idsubdivision=17649&idtt=1&idtypebien=1,2&nb_chambres=all&nb_pieces=all&pxbtw=NaN%2fNaN&surfacebtw=NaN%2fNaN&tri=d_px_loyer",75008,30 000 ,rdc,oui,2,04 / 11 / 2013,290,,2moiscc €,metro_paris:Monceau,Directement sur le Parc Monceau,500,,9,,,4,oui,,non,,,oui,oui,,"Appartement d'exception et de réception à louer meublé sur le Parc Monceau dans très bel Hôtel Particulier, avec entrée indépendante. Rez-de-jardin et 1er étage, d'une superficie de 500 M² sur son jardin privatif de plus de 200 M² le tout sur le parc. Volumes exceptionnels avec plus de 6m de hauteur sous plafond. Quatre réceptions, salle à manger 62 m², 4 chambres, 4 salles de bains, bureau, cuisine office de 45 m². Immenses caves. A louer en meublé à 30.000 euros mensuel plus charges comprises avec gardien et 2 emplacements de parkings. Chauffage individuel au gaz.",1 mois cc ht €,06 07 08 46 72,
"http://www.seloger.com/annonces/locations/appartement/paris-16eme-75/porte-dauphine/78897937.htm?bilance=all&bilanegs=all&cp=75&idqfix=1&idsubdivision=17649&idtt=1&idtypebien=1,2&nb_chambres=all&nb_pieces=all&pxbtw=NaN%2fNaN&surfacebtw=NaN%2fNaN&tri=d_px_loyer",75016,27 000 ,6,oui,2,04 / 11 / 2013,8232,,54000 €,metro_paris:Argentine;rer_idf:Avenue Foch,Métro Argentine,328,1960,8,6,oui,2,oui,,oui,central,séparée,,,oui,"Appartement meublé d'environ 328 m², situé avenue Foch (quartier Champs Élysées) dans un immeuble de standing, au 6ème étage avec ascenseur. Il comporte 1 salon, 1 salle à manger, 5 chambres, 1 cuisine séparée, 2 salles de bain et 2 salles de douche, WC séparés, et 1 terrasse. Le chauffage est collectif - urbain. Libre actuellement, il est à louer sur des périodes de 6 à 12 mois,+ de 12 mois.",37260 €,01 47 03 14 20,
"http://www.seloger.com/annonces/locations/appartement/paris-7eme-75/invalides/81937887.htm?bilance=all&bilanegs=all&cp=75&idqfix=1&idsubdivision=17649&idtt=1&idtypebien=1,2&nb_chambres=all&nb_pieces=all&pxbtw=NaN%2fNaN&surfacebtw=NaN%2fNaN&tri=d_px_loyer",75007,24 000 ,3,non,N.C,02 / 11 / 2013,EMPJF673,,,,,500,1900,7,5,,4,,oui,oui,gaz,équipée,oui,,,"EXCEPTIONNEL: Tour Eiffel AVENUE BOSQUET. Au 3ème étage avec ascenseur d'un immeuble Haussmannien de grand standing, nous vous proposons ce magnifique appartement de 7 pièces, immense galerie d'entrée en marbre, double réception, salle à manger face à la cuisine, cinq chambres (dont une très petite), quatre salles de bains, 5 WC (dont une sur le palier à coté de la cuisine pour le personnel), immense cuisine dinatoire entièrement équipée (marque Gaggeneau), buanderie, vestiare, nombreux placards et rangements partout. Climatisation. Système d'alarme. 2 chambres de service. Une cave blindée. Vue Tour Eiffel. Gardien. Jardin privé. Loyer: 24.000 Euros par mois + 1.000 charges. Renseignements et visites 7/7 au ou au avec Julie FINE (Référence de cette annonce: EMPJF673).",,0675181572 / 0147036601,
